Geopoitical Hate	পাকিস্তান একটি সন্ত্রাসী তৈয়ারি করা এবং রফতানি করা দেশ।
Geopoitical Hate	ভারত কে বিশাস করা যায় না। কারণ ভারত সুবিধা বাদী। 
Geopoitical Hate	মিয়ানমারের খানকিরপোলারা এখন যাস কেন
Geopoitical Hate	আমার যদি খোমোতা থাকত ভারত নামের রাস্ট্র টা মুছে ফেলতাম প্রিথিবী থেকে 
Geopoitical Hate	ভারত আমার শত্রু কারন তারা হিন্দু মুসলিম দের উপর অতাচার করছে। 
Geopoitical Hate	এবার থেকে তোর বাপ কে আম্পায়ার হিসেবে পাঠাইয়া দিশ। 
Geopoitical Hate	পাকিস্তান বাংলাদেশ এক থাকলে মায়ানমার বিশাল বড় বাশ খেতো
Geopoitical Hate	ভারত বাংলাদেশ ত্রখি 
Geopoitical Hate	আমি এখন ইনশাআল্লাহ সৌদি আরব আছি তারা হল জারজ সন্তান 
Geopoitical Hate	ভারত কখনো বাংলাদেশের বন্দু না, ভারতকে বন্দু বলা আর বিসাত্ত সাপকে চুমু দিবার মত,
Geopoitical Hate	আর ৫০ বছর পর পাকিস্তান নামে কোন দেশ থাকবে না। 
Geopoitical Hate	ভারত কুত্তা ধর্ষণকারি
Geopoitical Hate	আরে ভিকারী চুদা রা তোরা কী ভুলে গেলী জে তোদের সাধীনতা আমরা দীয়ে ছিলাম! 
Geopoitical Hate	ভারত ডাকাত এর মতো কাজ করছে বাংলাদেশে
Geopoitical Hate	ইন্ডিয়া ইচ্ছে চারালের দেশ 
Geopoitical Hate	ভারত নিজেরাই খাইতে পায়না আমাদের দেশে বিনিওগ কি করবে
Geopoitical Hate	ইন্ডিয়ান এক এক রাজ্যের সাথে তুলনা কর দেখবি কে বেশি এগিয়ে ফালতু কোথাকার
Geopoitical Hate	ভারত মাগির দালাল, 
Geopoitical Hate	উপমহাদেশের মুসলমানদেরকে তিন ভাগে ভাগ করে হিন্দু-ভারতীয়রা 
Geopoitical Hate	ভারত সবদেশের শএু।আর জারা পাকিসতান বাংলাদেশ বিরোদিতা করে তারা রাজাকার। 
Geopoitical Hate	এই খানকির ছেলেরা আবার তো হারলি। বাঘ আবারো নেরি কুততা হয়ে গেলো। কুকুর আবার বাঘ সাজতে যায়। 
Geopoitical Hate	ভারত হল বাংলাদেশের শোষক ও এক নম্বর শত্রু।
Geopoitical Hate	এক বার সামনে থেকে লড়াই শুরু করে দেখ। মীর জাফর মতো খালি পেছনে থেকে ছুরি মারার চেষ্টা করিস। 
Geopoitical Hate	ভারতকে বন্ধু ভাবার চেয়ে পাকিস্তানকে বন্ধু ভাবো 
Geopoitical Hate	এটাকে পাকিস্তান বলা ঠিকনা এটা হচ্ছে নাপাকস্তান 
Geopoitical Hate	ভারতীয় কুকুর গুলা কে তারিয়ে দেওয়া দরকার
Geopoitical Hate	এবার কাশ্মীর নিয়ে বাড়াবাড়ি করলে লাথি মেরে চার টুকরা করলে তবেই শিক্ষা হবে। 
Geopoitical Hate	ভারতে ধর্ষণকারি আছে আছে 100 কোটি, আর মাতাল আছে 120 কোটি 
Geopoitical Hate	ওই শালা মনে হয় সূচি কে বিয়ে করবে তাই কিছু বলছে না হবু বউরে। 
Geopoitical Hate	ভারত মুসলমাদের উপর জুলুম অত্যাচার করছ, উল্টা মিথ্যা অপবাদ দেছ, অহংকারেই একদিন পতন হবে ভারতের !!
Geopoitical Hate	কাংলুদের মায়ের শখ হয়েছে চীনা বারা খেতে 
Geopoitical Hate	ভারতের কথা আমি বলবো সারা জীবন বললেও হারামী দের কথা বলা শেষ হবে না
Geopoitical Hate	কুত্তার গলায় মুক্তোর মালা যেমন সুচির গলায় তেমন লাগে তাই ওর কাছে নোবেল পুরস্কার মানাই না 
Geopoitical Hate	ভারতের দালাল দিয়ে দেশ টা ভরে গেছে 
Geopoitical Hate	খানকির পোলাদের মাইরা ফালা,রোহিঙ্গা সব বিতাড়িত করা দরকার,
Geopoitical Hate	ভারতের দালালি যারা করে এরা ভারত চলেযাক এদের বাংলাদেশের দরকার নাই 
Geopoitical Hate	খানকিৱ পোলা ৱা শিক্ষা দীঘা কিছু নাই বলে CONDOM use কৱলো না!!!!!!
Gender abusive hate	স্বামী দুর্বল এমন কেউ সোনালী সময় নষ্ট না করে অামাকে কল করো। তোমার ভোদা চুষার জন্য সদা প্রস্তুত। 
Gender abusive hate	বাংলা দেশের মেয়েরা এতো অনেক খারাপ ছি ছি ছি 
Gender abusive hate	মেয়েরা বেকুবই হয় নতুন কিছু না হা হা হা
Gender abusive hate	মডেল না মনে হচ্ছে মাগী পাড়ার মাগী দুইটা।পঞ্চাশ একশো টাকা দিলে চোদা যাবে। 
Gender abusive hate	এই তোমাদের রেট কত ? তোমরা কি দুজনে একসাথে আসবা?
Gender abusive hate	২টারেই ফাকিং বিচ লাগতাসে, আর এই চোদনারা নাকি দেশরে রিপ্রেজেন্ট করছে
Gender abusive hate	২টার চেহারা দেইখা আমার বাসার কাজের বুয়ার কথা মনে পড়ল
Gender abusive hate	আপু তোমাকে বিদেশি গরুর মতো লাকতাছে 
Gender abusive hate	মাগির পুটকির নিছে কিতা? 
Gender abusive hate	তোর মায়ে কি ইংলিশ চোদা নাকিরে!
Gender abusive hate	নাছিরের ধন অনেক বড় তাই মেয়েটা পাগল হয়ে গেছে
Gender abusive hate	খানকি মাগি আখি আলমগির 
Gender abusive hate	মেয়ে দের লজ্জা নেই সে সবাই জানি 
Gender abusive hate	নারী বুজে চোদা। প্রবাসির মন বিজতে পারে না।
Gender abusive hate	এই মেয়ে টাকে পাছায় বারি দেয়া দরকার ছিলো। 
Gender abusive hate	খানকি কে গুদে টেন ঢুকাতে হবে 
Gender abusive hate	মেয়েরা বরো খানকী 
Gender abusive hate	এরকম নারী কে জুতা মার 
Gender abusive hate	মেয়েরা চুদার পাগল মাগির বাচ্ছা চিনাল বেডির পুরি
Gender abusive hate	আমি মাগি চুদব
Gender abusive hate	এই সব মহিলা দের কে ছবি তুলে ইচ্ছে মতো মরিচ লাগিয়ে দেন যাইগা মতো পুলিশ ভায়েরা 
Gender abusive hate	এই রকম মাগি কত যে আছে 
Gender abusive hate	এই রকম বড় মেয়েকে বিয়ে করতে হবে। দুধ খেয়ে মজা পাব।
Gender abusive hate	কমিশনার টের পাইলে তুর গুয়া দিয়া গরম ডিম দিব। 
Gender abusive hate	এই ডির বোদার মদেদ বর কালা বেগুন দিয়া এক বার ডুকান জেত আরেক বা বাহির করন জেত তখন এই ডি ঠানডা হলো নে
Gender abusive hate	মাইয়ারে পাইলে দুধ এর উপর ঘুম যাইতাম, আহা সেই মাল,
Gender abusive hate	হেতিরে মনে চাইতেছে টিপে দেই 
Gender abusive hate	পাচাও দুধ এক নামবার, তুমার জামা কুলে ফেল আরও সুন্দ হবে 
Gender abusive hate	এমন একটা পাইলে এক কম করে হলেও এক রাতে চারটি সট দিতাম 
Gender abusive hate	মালটা অনেক জটিল 
Gender abusive hate	মাল টা টিক আছে চুদলে মজা ই মজা পাওয়া যাবে 
Gender abusive hate	খানকি তোদের জন্য বাংলার যুবগয়া আজ খায়াপ বড বড দুধ আর পাছা ঢাকের রাখ মাগি
Gender abusive hate	এটা কমিশনার এর মেয়ে খানকিমাগির মেয়ে 
Gender abusive hate	মাগি যা দুধ রে , সব খুল 
Gender abusive hate	মাগির বুদা অনেক বড় 
Gender abusive hate	হায়রে মাগি কেমন করে । 
Gender abusive hate	মাগি বাজাঁরে জা টাকা পাবে বেশি করে। 
Gender abusive hate	আল্লাহ কে ভয় কর মাগি 
Gender abusive hate	ওর দুধ আর পাচা দেখেত আমার সোনা খারা হয়ে গেছে, আমি ওরে চুদলে ও অনেক খুশি হবে কারন আমি ১ ঘন্টার বেশি চুদতে পারি
Gender abusive hate	আহহ উহহ,কতো বড় বড় দুধ খালি ঝোকে মনে হয় ধরি 
Gender abusive hate	মাগির ভোদায় এতো জ্বালা কেন, 
Gender abusive hate	মাল ঠিক আছে খেলে আরাম পাওয়া যাবে সেক্সে পুরা শরীরটা ভরা
Gender abusive hate	দারুন দুধ গুলি অনেক বড়ো, আহা খাবো, কি মজা হবে? 
Gender abusive hate	তরে কত মানুষ গুয়া মারছে তা টিক নাই, দুধ দেখলে মনে হয় শুধু গুয়া মারছে না, দুধে শুনা ডুকাইচে তরে ছুধানির এক হাত নম্বা দন দিয়া গুয়া মারলে বুজতি তখন, 
Gender abusive hate	মাগির দালালের বাচছা মাগি 
Gender abusive hate	বরের চুদা পাই না।তাই এত নাচা নাচি। 
Gender abusive hate	এই মাল টা রে চোদলে মজা পাই বো 
Gender abusive hate	মাগি ও মাগিরে তুই অপরাধীরে 
Gender abusive hate	মালের দুধ দেখে মাথাই নষ্ট , যৌবনে টেলা দি
Gender abusive hate	ওড়না তো রাখনাই তাহলে কাপড় লগে রাখার কি দরকার ছিল ওটাও খুইলাই ফালাইতা 
Gender abusive hate	এ খানকি তোর গুদে কতো খিদে আমি তেকে চুবৌ
Gender abusive hate	আপনাদের মত মেয়ে দের জুতা মারা দরকার 
Gender abusive hate	এই খানকি তুই একটা বাসটেট 
Gender abusive hate	ওর গুদের মধ্য মোটা বাশ দিয়ে গূতিয়ে রক্ত বের করে দিতে হবে
Gender abusive hate	কোথাই গেলো মাগিরা সবাই বলে অসোহাই এটা কি এদের ভোদাই অনেক কামর এদের ভোদাই রড দিতে হবে ছি ছি ছি কি এরা 
Gender abusive hate	ওর বোদায় বালু ডালো আর সাবোল মারো 
Gender abusive hate	কুলাঙ্গার মহিলা
Gender abusive hate	শালীর জায়গামত মাগুর মাছ ঢুকানো উচিত 
Gender abusive hate	এরা মানুস নামের কল্নক মাগি স্বামি যত খারাপ হয় না কেন তাঁর পায়ের নিচে তুর বেহেস্ত 
Gender abusive hate	এসব কানকির বাচছা আর আর কানকির মাগী গো পাচায় বাশ ডুকানোর দরকার। 
Gender abusive hate	এরা মেয়ে নামের রক্ত পিপাসু ডাইনি এদরনের মেয়ে গুলিকে কঠিন বিচার করা হয়
Gender abusive hate	ওর বুদায় এসিট ঠেলে দেও 
Gender abusive hate	এই শালিকে একন ভাল করে চুদাতে হবে পা কাদে নিয়ে খানকি, 
Gender abusive hate	মাগির বিশাল বড় বাসের দরকার ভুল বললাম নাকি আরে তারে গুলিস্তানে রাস্তার মোড়ে উলঙ্গ করে ঘোড়ামারা উচিত
Gender abusive hate	এই মাগির ফুন্দে মরিছ দেও এবং কুফিয়ে মারো 
Gender abusive hate	এই মহিলার যউনাংগে ছুরি ডুকিয়ে মেরে ফেলা উচিত 
Gender abusive hate	ওর বোদায় বশি দিয়া বিদায়া টান দেয়া হোক 
Gender abusive hate	মাগি গুলা কইথেকে যে আসে আমি চিন্তা করে পাইনা
Gender abusive hate	এই কাংকির মেয়ে তর মার বুদার বিতরে লাল মরিস দিমু 
Gender abusive hate	তোমার মত এত সুন্দর মেয়ে কাছে পাইলে কত যে মজা করতাম। দেশ থেকে বিদেশে ঘুরতে নিয়া যাইতাম। অনেক আনন্দ করে ঘন্টার পর ঘন্ট চুদিতাম
Gender abusive hate	মাগিই তো মাগিই হয় 
Gender abusive hate	মাগীর পাচা দিয়ে বিকাশ ঢুকাইয়া দিলে ভালো হত 
Gender abusive hate	আস্তাো একটা খানকি মাগি টাকা কামানোর ধান্ধা 
Gender abusive hate	দেশটা মাগি দিয়া ভইরা গেছে 
Gender abusive hate	মাগি তো বোদায় ফসম আছে 
Gender abusive hate	মাগি ব্যাবসা লইয়া বসছে 
Gender abusive hate	এই টাকা কি তোর মাকে না বাপ কে ভাই কে বোন কে খাওয়াস মরবি না মাগি 
Gender abusive hate	ওমাগি আজ রাতে আমার কাছে আসি তোরে চুদ মোও?? 
Gender abusive hate	এর ভোদা সবাই ফাটাও
Gender abusive hate	তোর মা ও এই ভাবে ছেলেদের সাথে দুধ গুলা দেখাই দেখাই বিকাশের মাধ্যমে ছেলেদের টাকা খাইত ? 
Gender abusive hate	এই খানকি মাগি বেগুন আছে লাগবে 
Gender abusive hate	আরে নডি মাগির জাত লাইভে এসে ছেলেকে ভালো করো ভরে দিতে পারেন নাই বলে চলে গেছে।
Gender abusive hate	আমার তো মনে হয় তোর ভোদায় পানি গড়গড় করতেছে ছেলেদের সোনা ঢুকানোর জন্য।
Gender abusive hate	আমারে একটা ছেলে দেকে বিয়ে দাও।কারন আমার জালা সইতে পারিনা।মাগি কোথাকার। 
Gender abusive hate	কি আমাদের দেশ বসুন্ধরা তারি মাঝে এই খানকি মাগি হইছে আচুদা, চোদা নেওয়ার শখ বাড়ছে কুত্তা দিয়া চুদা নে চুতমারানি। 
Gender abusive hate	আস্তা একটা খানিক মাগী 
Gender abusive hate	এই গুলো খাঙ্কি মাগী 
Gender abusive hate	বেইশ্যার জন্মের ফসল মাগি। 
Gender abusive hate	এগুলা খানকি মাগি ভাই 
Gender abusive hate	খানকি মাগি তরা সমাজ টাকে নষ্ট করে ফেলতেছিস ।
Gender abusive hate	তোকে কুত্তা দিয়ে চুদাবো মাগি 
Gender abusive hate	এই সপ বেসসা পোতিতাদের মা বাপ নাই 
Gender abusive hate	তর ভোদার ভিতরে ভালো ভাবে বরে দিমু
Gender abusive hate	পতিতার মেয়ে 
Gender abusive hate	পুরা বেশ্যা মাগী 
Gender abusive hate	নষ্ট মেয়ে 
Gender abusive hate	পতিতা বৃত্তি ছেড়ে বিয়া করে সংসারী হও নয় তো জাহান্নামি 
Gender abusive hate	খানকিরা আল্লহর ভয় নাই 
Gender abusive hate	এদের মতন বেশ্যা মাগিদের জন্য সমাজে এত নুংরামী হয় 
Gender abusive hate	তুই একটা খানকিমাগী পতিতা 
Gender abusive hate	তুই হইলি মাগি আর তুর বইন সেত ডাবল মাগি তুত মা ও মাগি তুর গুস্টি সব মাগি মাগির ঘুরে মাগি তুগ সুদে বুদায়া লবন আর মরিছের ফাকি দেয়া ধরকার 
Gender abusive hate	ফালতু খানকি টাইপের মেয়ে। 
Gender abusive hate	মাগির ভুদায় অনেক চুরকানি কুত্তা দিয়ে চুদতে হবে। 
Gender abusive hate	মদ খাবো আর তোকে চুদবো।
Gender abusive hate	আরে মাগি কি করে বুদার এত জুর নাকি।
Gender abusive hate	বাবাখুর খানকির মেয়ে।
Gender abusive hate	মাগি তোর মাথায় আল্লার গজব পরুক।
Gender abusive hate	খানকি মাগিদের কি সুন্দর ব্যবসা ? 
Gender abusive hate	কাটা দিমো, তকে আমার ভালো লাগেনা আমি তর মাকে চুধ ভো, মাগি 
Gender abusive hate	কুততি তো কুততিই হবে মাগি।
Gender abusive hate	মাগি তর কি বড় ভাই নাই। তার সাথে ও ত খারাপ কাজ করতে পারিস 
Gender abusive hate	আসল মাগি।
Gender abusive hate	নোবেল প্রাপ্ত মাগি।
Gender abusive hate	মাগীর পুকটি দিয়া বিকাশ দিতে হবে?
Gender abusive hate	তোর বোদায় কাচা মরিস দিমু।
Gender abusive hate	তোমাকে কুকুর দিয়া চোদাতে হবে মাগি।
Gender abusive hate	কানকির জি।
Gender abusive hate	তোর সামাটাতে বাঁশদিয়া চোদা উচিত।
Gender abusive hate	মাগি খানকি তোর কি মা, বাবা, ভাই,বোন নাই মাগি 
Gender abusive hate	ঐ বেডি তুর বুকে পশম আছেনি?
Gender abusive hate	তোর মারে চুদি মাগি গরেরমাগি তোরেচুদি 
Gender abusive hate	তোর মাকে চুদি 
Gender abusive hate	এই মাগি আয় তরে ঘুরা দিয়ে চুদা দেওয়ায়
Gender abusive hate	আপু অনেক নিতে পারে। উফ কিভাবে এত ছেলের সাথে পারে? 
Gender abusive hate	তর মতো মেয়েদের জন্মের টিক নাই রাস্তায় জন্মেছিলে মনে হয়। 
Gender abusive hate	তোদের মত খানকির জন্য সমাজ টা শেষ।
Gender abusive hate	এগুলা রাস্তার মেয়ে।
Gender abusive hate	হিরু আলমও তরে চুদবেনা।তর মা বাবা কি পতিতার বাসিন্দা?
Gender abusive hate	টোর ভোদাতে সিল মারবো।
Gender abusive hate	তুমার কতা সিনে আমার চুদার কতা মনে পড়লো ,অনেক সুন্দর
Gender abusive hate	তর বোদা টা কালো হয়ে গেছে আমি তোমার বোদা টা দেখেছি ।
Gender abusive hate	চুতমারানি তর জন্মের ঠিক আছেরে খানকি সালি।
Gender abusive hate	তোর ত্রি সীমানায় গেলেও সবাই এইস,আইভি পজেটিভ হয়ে যাবে এত বাজে মেয়ে হয় ছিঃ
Gender abusive hate	মাগী সরম নাই সোনাটা দেখাবি মন চাইলে 
Gender abusive hate	তোরে হাতের কাছে পাইলে জুতা দিয়ে পিটাইতাম বেয়াদব মেয়ে।
Gender abusive hate	জাউরা একটা মেয়ে।
Gender abusive hate	আয় নটি মাগি তর ভুদা চুষে তকে সুখ দিব।
Gender abusive hate	মাগি তোরে চুদবো, কাম দিবি? 
Gender abusive hate	ভোদাটা কি ঠোটের মতো সুন্দর।
Gender abusive hate	চুতমারানি তোরে চুদী। কুত্তা দিয়া চোদামু 
Gender abusive hate	আপু ভুূদা চুইতে কী হয় 
Gender abusive hate	চুদার জন্য আগ্রহী কোন আপু কিংবা আন্টি থাকলে যোগাযোগ করতে পারেন। 
Gender abusive hate	ঢাকাৰ মাল চুদাছো শেমজা 
Gender abusive hate	ওরে সালি খানকি মাগি।
Gender abusive hate	এই গাই মারানি তর বাপ মার কোন পরিচয় আছে নাকি গাই মারানি
Gender abusive hate	গাই মারানি বাচ্ছা তদের সোনা দিয়া বাষ দেও দরকার 
Gender abusive hate	মা ছেলের চূদো চুদবে দিও।ধোনটা ধরে আস্তে আস্তে বের করতে হবে বের। 
Gender abusive hate	এরা দুই জন রহিংগা মাগি।
Gender abusive hate	এই মাগির তোর ভোদায় এসিড দিমু আমি আমি ছাএলীগ নেতা।
Gender abusive hate	তুই মাগি পরিচয় দিলি। তুই আসলে একটামাগি।রেট কত আমিও ছুদবো তোকে। খুব মজা পাবি। 
