Personal Hate	কিন্ত কথা হল এই মাগি রে বিয়ে করসে কে
Personal Hate	মাগিটারে সাকিব খান কাজের মেয়ে হিসেবে রাখাবে না।
Personal Hate	ঠিক মতো বাংলা বলতেই পারে না।সে আবার ডি জে।
Personal Hate	জত্তসব ফালতু চুদা কারবার, 
Personal Hate	এনারে তো pronstar মনে হইতাছে। 
Personal Hate	চুতমারানি একটা ... ইচ্ছা হইলে পর্ণ দেখব কিন্ত ওর গান না
Personal Hate	মাগিরে কুত্তা দিয়ে চুদানো দরকার। বাইর হ বাংলাদেশ থেকে তুই
Personal Hate	বুকের দুই পাশে দুই টুকরো ছিড়ে ফেললে আরও সুন্দর ও সেক্সি লাগত। 
Personal Hate	রাস্তার মেয়ে...পতিতার চেয়ে খারাফ।
Personal Hate	যদি জারজ না হয়ে থাকিস, তাহলে দয়া করে ভাল হয়ে যা 
Personal Hate	সনিকা যে একতা prostitute তা আপনার শো তে এসে প্রকাশ করল ।
Personal Hate	ফুল পর্ণ ভিডিও দেখাইয়া কস ইন্টারভিউ।
Personal Hate	লজ্জা পানির লগে মিশাইয়া খাইয়া লাইছে নাকি বুজতাছিনা।
Personal Hate	ইউটিউব নোংরা বানানোর কারিগর...
Personal Hate	বাঙালি না থাকলে উনি ন্যাংটা হয়ে খোলা আকাশের নিচে tot tot করতেন সম্ভবতো।
Personal Hate	তোদের তো চুদেই তো টাকা দেয়।
Personal Hate	সোভিকের মত ফালতু চুদা আর নাই 
Personal Hate	বাংলায় কথা বলতে কি আপনার কষ্ট হয়?
Personal Hate	মাগির চিহারা দেখলে পিটাতে মন চায়
Personal Hate	মাদারচোদ। হেটার পাছায় ভইরা দিমু। 
Personal Hate	ছুরি একটা মাগি!!
Personal Hate	তুই তোর মার পুটকি মার খানকির পুত 
Personal Hate	এটা মেয়ে না। ইহুদির বাচ্চা।
Personal Hate	আসিফের বাপে ওরে একটা আবাল হিসাবে পয়দা করছে
Personal Hate	তোমরা নুডিরা বাংলাদেশে ঝামেলা সৃষ্টি করতে যথেষ্ট!!!!
Personal Hate	কি বাজে Voice!! এই বেডি Autotune ছাড়া গানের দিকে আইলো কেমতে?? 
Personal Hate	এই সব পতিতা মানুষিকতার মেয়েরা আমাদের দেশের আবর্জনা
Personal Hate	আই হায় কি ভাব চুদায়, তুই আমার লাওরার ভিজা বাল।
Personal Hate	তুই ২০ টাকার খানকির চেয়েও নষ্ট মাগি। 
Personal Hate	হালার গরের হালা বাবা খোর
Personal Hate	ইউটিউবার দেখছি এমন বক্সচুদ ইউটিউবার তো দেখি নাই কখনো।
Personal Hate	ফেমিলি সো শালার তোর ভিডিওর শুরুতে আহ সাউন্ড।
Personal Hate	আবাল এইগুলোও তোর কাছে লোক হাসানো প্রশ্ন মনে হয়??
Personal Hate	ভালো কোন অনুষ্ঠানে যত সব মূর্খদের দাওয়াত করে। 
Personal Hate	সব গান গঞ্জিকা খাইয়া গাইছে হ্লা আবাল চুদারা
Personal Hate	দুইটাই পতিতালয়ে জন্ম নেয়া অবৈধ বেয়াদবের বাচ্চা! 
Personal Hate	ফালতু উপস্হাপিকা। বেশি নেকামি করে। 
Personal Hate	এই একটা মেয়ের গলা হুনলেই বমি আইসা পরে
Personal Hate	এই সব পাগল ছাগল ও ইন্টারনেট এ দেখতে হয়। 
Personal Hate	খাচ্চর মানুষ গুলার খাচ্চর মার্কা কথাবার্তা।
Personal Hate	মিস মূর্খ বাংলাদেশ প্রতিযোগিতা । 
Personal Hate	আরে হালার পোত ও মাতারি ইংলিশ মাড়াচ্ছিস ইংলিশেই মারা
Personal Hate	মাদার চোদ আরেক জনের গান নিয়ে মজা চোদাও MC MC mc 
Personal Hate	আজ একদম সিওর হলাম ওর কোন ইজজত নাই 
Personal Hate	খানকির পোলাগো ভাষা দেখো 
Personal Hate	দুধ গোলা এত্ত বড় করে পেলছে কেমনে?
Personal Hate	গলা শুনলে মনে হয় মুখে ধোন ভইরা রাখসে। 
Personal Hate	লুচ্চা খানকির পুলা
Personal Hate	মাগি ছাগলের ডিম ডুকাইয়া দিমু 
Personal Hate	কয়দিন পর চুদতে চুদতে বলবে তারা ফান করছে
Personal Hate	তুই একটা মাগির পোলা 
Personal Hate	ভাইয়া এই সব পাগল দেরকে নিয়ে আসেন কেন। 
Personal Hate	পয়দা হওয়ার পর যত গালী শিখছি সব ওর স্পর্শীয়ার গুদে দিয়ে দেব।
Personal Hate	ছোটা আজাদ আর স্পর্শিয়া দুইটারেই কাঁটা জিগারের চেলি দিয়া বাইড়ানি দরকার!
Personal Hate	ছিছিছি এই মেয়েটা এত নোংরা ভাপ্তেও পারিনা।
Personal Hate	মাগী টা চুদা খায় নিয়মিত মনে হচ্ছে। 
Personal Hate	"আপনার নাম যে কেন সবাই ""চটি আজাদ"" রেখেছে, তা আজ বুঝলাম। "
Personal Hate	যদি এমন হতো.তাহার দুই হাতার বদলে বুকের জায়গায় ফুটো থাকে
Personal Hate	এই বালপাকনা মাগী রে নিয়া আজকের এপিসোড টা বরবাদ করলেন।
Personal Hate	খানকির পুতেরা। কুত্তা দিয়া পুন্দামু মাংগের পোলা 
Personal Hate	সেক্স কোরে তার পর ভিডিও দে লাইভ এসে!! 
Personal Hate	দুদমারানি-দুদমারানি-দুদমারানি'। 
Personal Hate	কত জন যে চুদছে মাগীর ভোদাতে, স্পর্শীয়া মাগী। 
Personal Hate	এই সব বাইনছোদরে গারানো দরকার 
Personal Hate	বালের ব্যাকগ্রাউন্ড মিউজিক লাগাইসো 
Personal Hate	লাত্তি মেরে স্টেজ থেকে বের করে দেওয়া উচিত 
Personal Hate	বোকা চোদা বাইঞ্চদ সৌভিক কাইল্লা 
Personal Hate	Hiii লুইচ্চা আজাদ? কেমন আছো bro
Personal Hate	আসলে তোমার তো মা ও বোন নেই,
Personal Hate	মাগি আগের থেকেই বাধাই রাখছে আর কই পরের মাসেই বাধছে.
Personal Hate	তোরাই সমাজ নস্ট করিস,
Personal Hate	এই মাগিকে দিয়ে বারা চুসানোর ইচ্ছা করতেছে 
Personal Hate	চোদনা এইটা বুঝি ফ্যামিলি শোও রে..
Personal Hate	রোবট টাইপের মাগি।
Personal Hate	পরিচয়ের আগেই চুদে দিলো... 
Personal Hate	তরে তো পোক (পুক্কি) মারে ছোট আজাদ ওর ছোট মেশিন দিয়া
Personal Hate	তুই কি পতিতালয়ে জন্ম্য নিছিস
Personal Hate	তর আম্মু আব্বু ওরা সবাই পতিতালয়ের,
Personal Hate	ভুলটা প্রশ্ন কর্তার। সে একটা উন্নত মানে ছাগী টাইপ 
Personal Hate	জামাই যদি বাচ্চা হয় তবে জামাই কে দুদু খাওয়া
Personal Hate	এদের আসলে মানসিক বৈকল্য ঘটেছে। 
Personal Hate	মাগীরে দেখলেই মেজাজ খারাপ হয়ে যায় 
Personal Hate	মাগি তকে আর ভালো qsn কি করবে 
Personal Hate	বাংলাদেশ তে ভাগ মাগি নাহলে তোর পাছায় লাত্থি দিয়া মায়ানমারের পাঠামু
Personal Hate	শালারপুতরা বললে বাংলাই বল খিচুড়ি বলিস না। 
Personal Hate	তোমাদের এ শো থেকে জেচিকা শনাম নের চটি দেখা অনেক ভাল 
Personal Hate	এই ম্যাইয়ারে হেমায়েতপুর থেইকা খোলা অবস্থায় ছাইড়া দিছে কেড়ায়!!
Personal Hate	কয় হেই বাংলাদেশি না হেই আবার বাংলাদেশের নিমক খাইয়া হারামিপনা করে
Personal Hate	কিরে ভোদায় কি জল এসে পড়ছে নাকি ভিজে গেছে বলতেছস??
Personal Hate	ব্রা বলে? হা হা হা শালা লুচ্চা
Personal Hate	তারউপর এটা কেমন টাইটেল দিছস তোর ভিডিওর???
Personal Hate	যারা বিচারক তারাই ছাগল তা যারা প্রতিযোগিতা তাদের কি অবস্থা হবে
Personal Hate	এসব ভালগার ভিডিও বানানো অফ কর। 
Personal Hate	মাগি তুরে কুত্তা দিয়া চুদান উচিত।
Personal Hate	ভাইব্রাদার এখন সফটপর্ণের চ্যানেল হইছে।
Personal Hate	মনডায় কয় মাগির বাচচারে টান দিয়া সাওয়া টা ছিড়তে পারতাম
Personal Hate	তুই শালায় এই ডি কি লাগাইছোস
Personal Hate	YouTube account খুলছোস ভালো কিছু বানা যাতে মানুষ দেখে
Personal Hate	গন জাগরেণ নিয়া চুইদা এইটার ভোদের রস বাহির করার দরকার
Personal Hate	আরে তুই তো বাজারের মেয়ে থেকেও খারাপ। 
Personal Hate	তোদের ভোদার রস যখন শুকিয়ে যাবে তখন তোদের কুত্তাও চুদবেনা 
Personal Hate	বাঁশ এর বাড়ি আবার খাবি নাকী গরুর হাটে 
Personal Hate	ছোট আজাদের মরিচ আসলেই ছোট।
Personal Hate	দেখে মনে হচ্ছে চুরি করতে গিয়ে ধরা খাওয়ায় বাশের বাড়ি খেয়েছ।
Personal Hate	বাংলায় ভোদা বললে দোষ আর ইংলিশ এএ Pussy শুনতে খুব ভালো লাগে একেবারে মন ভইরা সোনা খারায়া যায় না?
Personal Hate	বান্দির পুতকেতো দেখতে ফকিন্নি লাগে।বস্তির পুলা,শালা টুকাই। 
Personal Hate	এই কুত্তার বাচ্চা এটা কি ইংলিশ অনুষ্টান মাদাদর চোদ
Personal Hate	এর যদি ভিডিও বাহির হয়,প্রভার চেয়ে ও বেশি চিল্লাই বো,
Personal Hate	চুল মডেল এইটা। দেখলেই রাগ উঠে।
Personal Hate	হ... বাংলাদেশের চ্যানেলে তোর বাল চালাবে... 
Political Hate	স্বাধীনতার ঘোশনা কে দিয়েছিলো তোর বাপ তাহলে তুইতো তোর বাপের স্তান না রে সালা
Political Hate	দেশের জনগণের কাছে তাদের গ্রহণযোগ্যতা নেই, জনগণের সঙ্গে কোনো সম্পৃক্ততা নেই । : ওবায়দুল কাদের
Political Hate	মইনুল রাজনৈতিকভাবে চরিত্রহীন: হাছান মাহমুদ
Political Hate	আগে নিজেদের চরিত্র ঠিক করে তারপর অন্যদের সমালোচনা করুন । : হাছান মাহমুদ
Political Hate	প্রকৃতপক্ষে আপনি রাজনৈতিকভাবে চূড়ান্ত চরিত্রহীন । : হাছান মাহমুদ
Political Hate	নির্বাচন কমিশন তো নিজেরাই বিভক্ত হয়ে পড়েছে । : মির্জা ফখরুল
Political Hate	ইসি এই দায়িত্ব পালন করতে পারে না । : মির্জা ফখরুল
Political Hate	আমরা প্রথম থেকে বলে এসেছি, এই ইসি যোগ্য নয় ।  : মির্জা ফখরুল
Political Hate	এরা কাজ করতে পারবে না, নির্বাচন করতে পারবে না । : মির্জা ফখরুল 
Political Hate	নির্বাচন কমিশনের নিজস্ব কোনো ক্ষমতা নেই । : মির্জা ফখরুল
Political Hate	যে সরকার ইতিমধ্যে সব প্রতিষ্ঠান দলীয়করণ করেছে, সেই সরকারের ব্যক্তিদের দিয়ে নির্বাচন পরিচালনা অসম্ভব । : মির্জা ফখরুল
Political Hate	কমিশন সচিবের কথা শুনলে মনে হয়, তিনিই প্রধান নির্বাচন কর্মকর্তা । : মির্জা ফখরুল
Political Hate	প্রধান নির্বাচন কমিশনারকে মনে হয়, সবচেয়ে অসহায় ব্যক্তি । : মির্জা ফখরুল
Political Hate	সকালে একটা বলেন, বিকেলে আরেকটা বলেন ।  : মির্জা ফখরুল
Political Hate	সাত দিন আগে এক কথা বলেন, আর সাত দিন পরে আরেক কথা বলেন । : মির্জা ফখরুল
Political Hate	এই ইসির অধীনে কীভাবে একটি সুষ্ঠু নির্বাচন হবে? : মির্জা ফখরুল
Political Hate	সিইসির এখতিয়ারটা কী? আওয়ামী লীগকে ক্ষমতায় বসিয়ে দেওয়া তাঁর (সিইসি) এখতিয়ার?: মির্জা ফখরুল
Political Hate	খালেদা জিয়াকে জেলে আটকে রাখবেন, আর আপনি নির্বাচন করবেন, এই নির্বাচন হবে না, মানুষ মেনে নেবে না । : মির্জা ফখরুল
Political Hate	ঐক্যফ্রন্টের মাধ্যমে সরকারের পতন হবে । : মওদুদ আহমদ 
Political Hate	মাইি অতি চালাক । অতি চালেকের গলায় দরি । হা হা হা 
Political Hate	এগু লো বি এন পি র বিরু দ্ধে মা হির চক্রান্ত 
Political Hate	জাতীয় ঐক্য প্রক্রিয়া থেকে ছিটকে পড়ে মাহি'র চুলকানী শুরু হয়ে গেছে । 
Political Hate	মাহি এবং তার বাবার জামাতের ১,ইউনিয়নের ভোট ও নেই
Political Hate	দুই জাতীয় বেঈমানকে বের করে দেয়ার পর চুলকানী শুরু হয়েছে । 
Political Hate	বিড়াল শুটকির নাগাল না পেলে বলে পরের হক্ব খাইনা
Political Hate	শালা বাপ বেটা দুজনই রাজনৈতিক এতিম । 
Political Hate	মাহি বি দুই বাব বেটা মিলে ১টা আসন পাবেনা,তার আবার বড় বড় কথা,
Political Hate	মাহির কথায় বুঝা যায় যে এই ফোন আলাপ সাজানো এবং সরকারের নির্দেষ অনুযায়ী 
Political Hate	মাহির কারনে তার বাপের এইদশা
Political Hate	বাল পাকনা ভালো .এত বেশি বাল পাকনা ভালো না. 
Political Hate	এই বি মাহি মার্কা লোকের কোন দরকার নাই । । । 
Political Hate	এইটা বুযতে হবে জাতিতে এই সব কাউয়া কাদিরার সাজানো নাটক
Political Hate	সরকার এর সাথে আতাত করে ঐক্য নিয়ে চক্রান্ত তো আপনারা বাপ বেটাই করছেন মি: মাহি!
Political Hate	বাপ বেটারে আরো আগে লাতি দেওয়া উচিৎ ছিল 
Political Hate	মাহির মতো গাদা না থাকলে ঐক্যের কোন সমস্যা হবে না । 
Political Hate	মাহি তুই কুকুরের মতো গেউ গেউ করোছ কা, শালা দালাল চক্রের মধ্যে তুই একজন 
Political Hate	মাহীবি একটা ভেদধব ইস্টপিট 
Political Hate	মাহি বি চৌধুরী আওয়ামী লীগের দালাল
Political Hate	মাহী তুই একটা হাইওয়ান 
Political Hate	এগুলি সব এডেটিং করেছে মাদার চুদের সরকারের দালাল রা । !
Political Hate	মাহি বি চৌধুরী একটা দালাল এইটা সহজ ভাবে বুজতে পারা আর বাকি রইলোনা সো সেড 
Political Hate	এটা হচ্ছে মাহির এবং সরকারের আরেকটা চাইল । 
Political Hate	আপনারা দেশকে ভালবাসেন না, আপনারা অনকে লোভি । 
Political Hate	মাহী বেশী চুল পাকনা লোক
Political Hate	বাপ বেটা মিলে নতুন দালালী শুরু করছিলো 
Political Hate	মাহি কোন চেটের বাল মেম্বার হোওআর জুগগোতা আসেনি সাউআর পুতের 
Political Hate	মাহি যে ব্যক্তি একটা মেম্বার হওয়ার যোগ্য না বেটা বেশি পটর পটর করে 
Political Hate	চাগল দিয়ে যেমন হালচাষ হয় না এদেরকে দিয়ে কখনোও দেশ চলবেনা 
Political Hate	মাহি তোর মুখে আল্লাহর নাম মানায় না কারণ তো ইসলাম বিদ্বেষী 
Political Hate	মাহির আচরণে ছাগলের ৩ নাম্বার বাচ্চার মত লাগছে । 
Political Hate	মাহি বি চৌধুরী জাতীয় বেইমান, 
Political Hate	মাহী চৌ বাস্ট্রার্ড ,ইন্ডিয়ান সৌর হাসিনার দালাল,
Political Hate	মাহি পাগল হয়েগেছে । 
Political Hate	মাহি বর্তমান রাজনীতিতে আওয়ামী লীগের চামচামী করতেছে । 
Political Hate	মাহী তুই মাগীর ছেলে জারজ 
Political Hate	ঐক্যটাকে ধ্বংস করছে শয়তান মইনুল ইসলাম । 
Political Hate	মাহি শুয়োরের বাচ্ছা অটিস্টিক জয়ের এজেন্ট 
Political Hate	মাহি বি চোধুরী, এ তো দেখি পুরাই আওয়ামী দালাল । 
Political Hate	মাহি যে একটা বড় মাপের টাউট তা তার ক্ষিপ্ত ভাষা থেকেই বুঝা যায় । 
Political Hate	একজন মেম্বারের যোগ্যতা যার নাই অথচ কত্থা বলে ইচরে পাকার মতো । 
Political Hate	মাহি বাদ পড়ে মাথা খারাপ হয়ে গেছে । 
Political Hate	জামাত কি তোর মা বোনরে চুদছে মাদার চোদ 
Political Hate	জামাতের এক ইউনিয়নের জা ভোট আছে তোদের বাপ বেটার সারা বাংলাদেশে সেই ভোট আছেনি
Political Hate	শালা বাসটারড হাসিনার পাও চাটা কুত্তা 
Political Hate	২ সালারে, বেধে,জামা কাপড় খুলে,পাচার মধ্যে ক্রশ ক্রশ করে মারতে হবে, বেত দিয়ে
Political Hate	মাহি একটা মাগির চুদা । 
Political Hate	দালাল মাদারি,জামাতের একটা আসনের হাফ ভোটে ও পাবে না, 
Political Hate	মাদারি মাহি তুই কি ভদ্র??
Political Hate	তুদের কে বের ক রে দেয়াই খুব ভাল করছে, 
Political Hate	মাহি বি চৌধুরী একজন স্টুপিড, হেই একটা বাস্টার্ড.
Political Hate	আরে বেটা মাহি গাবি না কিনে বালতি নিয়া চিন্তা করস 
Political Hate	তোরা নির্বাচন করলে তোমরা দুই আসনে পাবি না
Political Hate	ছেটের,বাল,একছিট,পায়র,যৌগ্না,15o,ছিট,ছায়,ছেটের,বাল
Political Hate	মাহিরে চুদার সময় আছে বাঙালির....
Political Hate	মাহি বি চৌধুরী একলা হয়ে এখন কুত্তার মতো ঘেউ ঘেউ করতেছে 
Political Hate	সামনে জুতা পেটা অপেক্ষা করতেছে মাহি । 
Political Hate	আওমীলিগ আর কতো অভিনয় করবি মাদার চোদ্দ আওমীলিগ 
Political Hate	খানকির পোলার সরকারের দালালরা তোদের এখন এগুলা ছাডা আর কোন কাজ নাই 
Political Hate	মান্নাদের আসল উদ্দেশ্য ফাঁস করে দিসে নতুন প্রজন্মের মাহী চৌধুরী.. 
Political Hate	মাহি মার্কায় ১৫০আসন চাই । এখন বেশি করে খা 
