Political Hate	বি চৌধুরীর নাম নিশানা ডুবিয়ে দিতে মা চৌধুরী যথেষ্ট । 
Political Hate	এইসব ঐক্যধারীরা বাংলাদেশের একটা ওয়ার্ডের চৌকিদার হওয়ারো যোগ্যতা রাখে না । 
Political Hate	মাহি কি বাংলাদেশের চ্যাটের বাল যে তাকে ছাড়া ঐক্য হবে না
Political Hate	এই জোট চাইনিজ মালের মতো যেকোনো সময় রং চলে যেতে পারে 
Political Hate	মাহী নিজেকে বড় আব্দুল্লাহ্ মনে করে । নিজের ভোট নাই ১০ টা 
Political Hate	বাপ-বেটা নিজেদের বাদ দেয়াকে রাষ্ট্রবিরোধী ষড়যন্ত্র বলছে । নিজেদেরই রাষ্ট্র মনে করে নাকি? 
Political Hate	বাল চৌধুরী এতো কথা বলে ক্যান! সরকারের দালাল 
Political Hate	ওদের কে বাংলার মুসলমান মরলেও জানাজা দিবেনা ওরা মুনাফেক । 
Political Hate	মাহি বাজেচৌধুরী.ফালতু লোক মাহি । 
Political Hate	মাহী সে মানুষ টা বেশী ভাল না । 
Political Hate	মাহি কে আরো আগে বাদ দেয়া দরকার ছিল সালা খেলপ 
Political Hate	মাহি তুই খানকির পোলা তোর বাপ মাগির পোলা শালা দালাল 
Political Hate	কিরে খানকির পোলা এই কথাগুলোর মধ্যে রাষ্ট্র বিরোধী ষড়যন্ত্র কই বলছে, তোর মার ভোদা বেশ্যা মাগীর পোলা 
Political Hate	মাহি ও বি চৌধুরী কাদাপানিতে আটকে গেছেন । 
Political Hate	তোমরা কোন দেশে থাকো,কথা কথা ষড়যন্ত্র খুজো,কি বাল আছে তোমার দেশে 
Political Hate	বদরুচ্ছুদা আর মাহী বাল চৌধুরী, একটা বেইমান জাতীয় বাইমান 
Political Hate	দালাল কোথাকার তর য দি লজ্জা থা কে ঐক্যের বেপা রে একটা কথা বল বি না । 
Political Hate	মান্নার ফাঁসানোর মতো কি আছে এখানে? বলদার বলদা
Political Hate	মাহি ছৌঃ পরিবার বাটপার । 
Political Hate	বলদ! নিজেরে নওয়াবজাদা সলিমুল্লাহ মনে করে!
Political Hate	জামায়াতের একটা কর্মীর জ্ঞান নাই যার মধ্যে সে নাকি বি এন পিকে জামায়াত ত্যাগ করতে বলে । 
Political Hate	মাহি কি অরজিনলী বি চৌধুরীর ছেলে?জন্ম নিয়ে সন্দেহ আছে । 
Political Hate	দেশের মানুষ একদলের শাসনে অতিষ্ট হয়ে গেছে আর বেশ্যের ছেলে ব্যবসা ঠিক রাখার জন্যি সরকারের সাথে আতাত করে হিয়ালী চুদাচ্ছে 
Political Hate	তুদের কারনেই জামায়াত আজ সাধারাণ মানুষের প্রিয় দলে পরিনত হয়েছে । প্রমান চাইলে নিরপেক্ষ নির্বাচন দিয়ে দেখতে পারিস । 
Political Hate	কিরে রনি,তুই কি মাহির ও ছাত্র হওয়ার যোগ্যতা রাখিস না?
Political Hate	এটি তুই কি বুঝে শুনে বলেছিস,না মাল পানি খেয়ে বলেছিস । 
Political Hate	রনি সাহেব বলছিল,আওয়ামীলীগ কে জুতা দিয়া মারলে ও মান সন্মান যায় না এখন দেখি,তার তাও যায় না 
Political Hate	মন্জু চোরের পুলা পার্থ বিয়াদপ
Political Hate	পার্থ সালার পুত হলো হাসিনার বড় দালাল, পার্থ কে বিএনপির যোট থেকে বাদ দেওয়া হক 
Political Hate	রনি মাদারচোদ টাইপ লোক 
Political Hate	বিএনপি এখন পাগল হয়ে গেচে 
Political Hate	তুই কয়টা ভোট পাবি রে BNP এর সাথে না থাকলে । তর মত বোয়াদব নাই পাথ । 
Political Hate	পার্থ্য খানকির পোলা 
Political Hate	পার্থ্য একটা বেইশ্যা মাগীর পোলা
Political Hate	কথা গুলো দুদু মাদারচুদেরে সুনান 
Political Hate	বি ন পি র পাগলদের এবার বুদ্ধি হবে
Political Hate	ডঃ কামাল হোসেন ভারতের দালাল হয়ে বিএনপিকে ধ্বংস করতে এসেছে । 
Political Hate	কামাল সাহেব তো বুরা হয়ে গেছে ঠিক মত কথা বলতে পারেনা সে কি করে দেশ চালাবে । । বুজিনা । । 
Political Hate	শালা চোর এর বাচ্চারা 
Political Hate	বিএনপি কামালের পা চাটতে গেছে যেনো আইনের লড়াই করে খালেদা জিয়া কে বের করে 
Political Hate	পাগল একটা, সালা জিয়ার গুনগান কর, 
Political Hate	মাকালফল খেতে কোন স্বাদ নাই...আপনি একটা মাকালফল! 
Political Hate	বাংলাদেশি জাতীয় বাটপার । 
Political Hate	এই ঐক্য চোর আর শতানের ঐক্য 
Political Hate	শালা মাদার ছুদ তুই একটা জারজ 
Political Hate	অত্যাচারের সীমানা ছাড়িয়ে গেছে আওয়ামীলীগ পতন হতেই হবে উপায় নাই । 
Political Hate	কুত্তা লীগের পতন চাই 
Political Hate	হাছিনা স্বৈরাচার মুক্ত বাংলাদেশ ছাই নিরপক্ষে নির্বাচন ছাই
Political Hate	হাসিনার পতন চাই,সৌর হাসিনার কুত্তালীগ বাংলার মাঠিতে আমরা আর চাই না,!!!! 
Political Hate	মাঠে সালার পুতেরা । কুত্তার মত পিডামু 
Political Hate	সালার পুতেরা তোদের দৌড়ায় দৌড়ায় পিঠা, সব ঠিক হয়ে যাবে । 
Political Hate	আচুদার গুষ্টি বিম্পি! 
Political Hate	একদম ঠিক বলছে মূর্খ নেত্রী খালেদা জিয়াকে দেখতে চাই না 
Political Hate	জারজ মানেই বিএনপি
Political Hate	বি এন পি, দলটি পুরায় অশিখিতো শালার শালারা
Political Hate	কুত্তালিগের এনি একজন কুকুরের বংশধর কুকুরের বাচ্চা কুকুর
Political Hate	হালারা সব মাতাল সমাজটাকে নষ্ট করে পেলছে । 
Political Hate	বিয়েনপি আসলেই একটা পাগলের দল 
Political Hate	গুন্ডা পান্ডা পাগল ছাগল দিয়ে দেশটা বরবাদ করে দিচে শালারা 
Political Hate	বর্তমান সরকার কোন সরকারেই না??জারত সন্তান যে রকম, সেই রকম ও বর্তমান সরকার?? 
Political Hate	শেখ মুজিব না থাকলে, দেশ স্বাধীন না হলে জিয়া তোর মা আর তোর মত কুত্তারে স্বীকার করত না
Political Hate	তোর মা তো যুদ্ধের সময় পাকস্তানে ভালোই আরাম আয়েশ করেছে । 
Political Hate	ওটা নাকি দেশ নায়ক লন্ডনে বসে সালা চুর 
Political Hate	Ei kuttar বাচ্চা ক্ষমতায় আসলে দেশের ইতিহাস নষ্ট করে ফেলবে
Political Hate	এ মাগির পুলা তুই চুর কিসের দেশ নায়ক তুর মারে চুদল পাকিছতানিরা তুইআবার বড় বড় কথা বলিস
Political Hate	তুই মরলে দেশে সানতি আসবে
Political Hate	কুত্তার বাচ্চা তোর মুখের ভাষা ঠিক কর । তারেক কি বলবে কি বুঝবে । তুই শালা বাটপার । 
Political Hate	তোর মত ছাগলে কথা বাঙ্গালী এখন আর বিশ্বাস করে না রে 
Political Hate	খানকির বাচ্চা তারেক জিয়া।
Religious Hate	আল্লাহ তো ঘরে ঘরে চুদানোর কথা বলেছে নবী তো বড়ো মাদারচোদ আল্লা চুদিরা তোরা তো নীজের বোনরে চুদিস 
Religious Hate	মালাউনদের এই অধপতনে আমরা খুশি 
Religious Hate	মালুরা গ মুত খেয়ে তাদের মাথার তার নষ্ট হয়ে গেচে 
Religious Hate	হায়রে মালু আরো কতকিছু করবি তোরা তারাতারি গজব আসবে মনে হয় তোদের উপর 
Religious Hate	হযরত গৌতম বৌদ্ধ ??? হা হা হা হা হা !! তুরা কি গরু না ছাগল রে কাদিয়ানীর বাচ্চারা !!
Religious Hate	ওই শালার পোলা মিথ্যে বলিস কেন বুদ্ধ ধর্মের উৎপত্তি কথ সালে আর ইসলাম ধর্মের উৎপত্তি কথ সালে,না জেনে শুনে কথা বলিস কেন ? 
Religious Hate	হযরত বৌদ্ধ??? শালা ছাগল!!
Religious Hate	ভন্ড কাদিয়ানী থেকে সাবধান
Religious Hate	বালের পুজা, 
Religious Hate	শিব একটা ধর্ষক ছিল, সে ৬০ হাজার কুমারী মেয়েকে ধর্ষণ করেছিল, তাই শিব লিঙ্গ ধর্ষণের প্রতীক।
Religious Hate	ইন্ডিয়ার হিন্দুরা শুন মুসলিমদের সাথে ভাল ব্যাবহার কর নাইলে কপালে দুঃখ আছে।
Religious Hate	বিশ্বের ইতিহাসে হিন্দুরা ভিতু, তদের কথাতে মুসলিমরা ভয় পায়না।
Religious Hate	মুসলমানদের বসতে দিলে শুতে চায় 
Religious Hate	ইনড়িয়া মুসলিম রাষ্ট ছিল থাকরে-- জারা ইয়াহুদি কাফের হান্দু হয়ে গেল - তাদেরকে মোসসলমান বানাতে হবে
Religious Hate	হিন্দু বা কাফের দের সাতে হাত মিলিয়ে সারা দুনিয়াতে ফেতনা লাগায়ে নিজেরা শেষ হয়ে জাচ্ছে 
Religious Hate	চুদি আৱবেৱ ধমঁ!
Religious Hate	ভারতে মুসলিম আরো বেশি হবে কারণ বড় বড় চোর গুন্ডা নেতা সবাই হিন্দু
Religious Hate	হিন্দুকে কুতার মুতুন চুদছি 
Religious Hate	পৃথিবীর সবথেকে মিথ্যাবাদী ধর্ম হিন্দু 
Religious Hate	শুয়োরের বাচ্চা মুসলিমরা,
Religious Hate	ইসলামে মারে চুদেছে ইসলামে মারে নাভি চুদা ভোদা দুদু ভোদা দুদু চুদি তোদের মাহিলাদের 
Religious Hate	এরা মুসলিম স্টেট এ শুয়োরের মতো মুসলিম শোরের বাছা জম্ম দেবে আর অন্য জাগায় কাফের হত্যায় পাঠাবে । 
Religious Hate	বেদব তুই টয়লেটে পরে মরবি শয়তান কুতথার বাচছা হারামি নবীর দুশমন
Religious Hate	ইসলাম মানে অশান্তি ধর্ম 
Religious Hate	হিন্দু-বৌদ্ধ-খ্রিস্টানদের মধ্যে সমস্যা নেই I অথচ দেখতে পাওয়া যাচ্ছে, মুসলিমরাই কেবল সমস্যা সৃষ্টি করে চলেছে 
Religious Hate	হারামি বাংলাদেশী মুসলিম দের মেরে ফেলা উচিত,
Religious Hate	মুসলমান মানেই জিহাদী জঙ্গিবাদ
Religious Hate	খুব তাড়াতাড়ি মুসলিম ধংশো হবেই
Religious Hate	বাংলাদেশের মুসলিম লোকেরা মানুষ না সব কুকুর । 
Religious Hate	যদি পৃথিবী ধ্বংস হয় তবে তার কারণ হবে মুসলিম। 
Religious Hate	কাংলাদেশের মুসলিম দম আছে তো ভারতে করে দেখা , তোদের গাড় ফাটিয়ে দেব। 
Religious Hate	মুসলিন জাতি বেইমান এবং জেহাদি ছিল, আছে , থাকবে
Religious Hate	মুসলিমদের এই বেইমানি আর জেহাদির কারনে পৃথিবীর সমস্ত জাতি মুসলিমদের ঘৃণা করে.
Religious Hate	মুসলমানরা গুজবে বিশ্বাস করে, বাস্তবে নয়। মানে, মাথায় ব্রেন নামক পদার্থটার অভাব!!
Religious Hate	পাগলে কিনা কয় ছাগলে কিনা খায়,যাদের দেবতা গরু ছাগল হাঁস মুরগি ভেড়া কুত্তা শিয়াল বানর হনুমান হাতি সাপ কেঁচো কৃমি তারা আর কত ভালো হবে
Religious Hate	হিন্দু মানে অশান্তির ধর্ম,তারাই মুসলমানদেরকে নির্যাতিত করছে
Religious Hate	চলো আমরা সবাই মুসলিম মারা শুরু করি 
Religious Hate	বাংলাদেশের হিন্দুরা এখনো বেহেশতে আছে।তুই কি জানিস।
Religious Hate	সালা পাগল হিন্দু রা বাংলাদেশে যেভাবে শান্তিতে থাকে ভারতেও এভাবে থাকে না
Religious Hate	বাঙালি হিন্দুরাই ভীতু চোদা তাই নুনু কাঁটা পিসলামিক শুয়োরগুলো ওদের অত্যাচার করে.
Religious Hate	মাদারচোদ হিন্দুরা ভয়ে ইন্ডিয়া তে পালিয়ে না এসে উচিৎ মুসলিমদের কচুকাটা করে দুনিয়া থেকে নির্মূল করে দেওয়া. 
Religious Hate	শালা তুই কট্টরপন্থী হিন্দু
Religious Hate	তুই হালা দালাল তোর হিনদু বাপেরা ভারতে মুসল মানদের ওপর কি ভাবে অতাচার করিছে
Religious Hate	বাংলাদেশের মুসলমান জদি হিনদের ওপর অতাচার করে তাহলে বাংলাদেশে এত হিনদু জায়গা পেতো না হালা মাদার চুদ 
Religious Hate	এই সব রকম বালের মুসলমান যেখানে বিপদ সেখানেই ।
Religious Hate	একটি বিখ্যাত, আবিষ্কারক মুসলমানের নাম কেউ শুনেছে কখনো..ক ্যানসারের ধর্ম ইসলাম.
Religious Hate	বাংলাদেশের মিডিয়া ভারতের হিন্দুদের দালাল..
Religious Hate	ভারত কোন হিন্দুদের তাড়াচ্ছে না তাড়াচ্ছে মুসলিম জেহাদি মোল্লাদের ! 
Religious Hate	তোর বাড়িতে অপরিচিত মুসলিম ঢুকে পড়লে তুই কি করবি মোদী শেটাই করচ্ছে!
Religious Hate	সমস্ত হিন্দু NRC এর সমর্থনে ঝাপিয়ে পড়ুন ! ওই ধংশো কারি মুসলিম দের তাড়াতেই হবে !
Religious Hate	শুধু আসাম না পশ্চিমবঙ্গ থেকে ও এই জেহাদি মুসলমানদের খেদানো হবে !
Religious Hate	বাংলাদেশ থেকে হিন্দুদের তাড়িয়ে দেওয়ার পরিণাম এটা 
Religious Hate	তোরা ত সব জানতা,অতই জানতা ত হিন্দু দের কেন তারাছিস,সালা মোল্লা
Religious Hate	এই মুসলিম দের আতি তারাতারি ভারত থেকে তারাতে হবে।
Religious Hate	আই দেখিয়ে দেব এবার ।মুসলিম দের কে এবার জবাই করবো।জয় শ্ৰী রা
Religious Hate	যখন বাংলাদেশ থেকে হিন্দুদেরকে তারানো হচ্ছিল তখন কোথায় ছিল সহিংশুনতা 
Religious Hate	মুসলিম গরু চোর সন্ত্রাসী বাংলাদেশীদের হিন্দুস্থান থেকে বাহির হতে হবেই
Religious Hate	আসামের রোহিঙ্গা মুসলমানদের তারিয়ে দেওয়া হোক কারণ এরা ভারতের মানুষ নয় 
Religious Hate	জনে চার পাঁচ টি বিয়া কইরা সুকরের বাচ্চা পায়দা করার সময় মনে থাকে না ....শালার জাত পরে ভিক্ষার ঝুলি নিয়ে হিন্দুস্তানে
Religious Hate	তর মা কে চোদী শালি দেহ ব্যবসায়ী। বাংলাদেশের সব মুসলিম মেয়েরা ঘরে ঘরে ইমু সেক্স করে রোজগার করে ভাত খায়
Religious Hate	অবৈধ মুসলমানদের লাথ মেরে তাঁড়ানো হোক
Religious Hate	নডির পোলা নাস্তিক তোর মারে বাপ 
Religious Hate	তুই একটা সুবিধাবাদি,তুই হিন্দু ও না আবার মুসলিম ও না, তুই একটা নাস্তিক। 
Religious Hate	ইহুদীরা আসলেই খুব বিপজ্জনক 
Religious Hate	হিটলার কে ধন্যবাদ কারণ ইহুদীরা আসলিই খারাপ 
Religious Hate	হিটলার একজন সত্যিকারের লোক যে ইহুদী সব শেষ করার প্রতিগ্গা করে,
Religious Hate	ইহুদীরা মানুষ খারাপ, 
Religious Hate	এই পৃথিবীতে একটা মহাপাপ ধর্ম আঁছে তার নাম হলো আব্রাহামিক ধর্ম
Religious Hate	সব ইহুদীকে মেরেফেলা উচিৎ ছিল
Religious Hate	সব ইহুদিকে একবারে হতা করলে ভালো হতো
Religious Hate	ইহুদিরা অনেক ভয়ংকর। 
Religious Hate	ইন্ডিয়ান হিন্দুগুলা আস্ত বেয়াদব, উগ্র। 
Religious Hate	মুর্তিপুজারী,মাজারপুজারী,ভন্ড পীরদের পোদ ফেটে গেছে। 
Religious Hate	হিন্দু ধর্ম তো এইটাই জানে না যে প্রিথিবি গোল
Religious Hate	মালাউন কে জুতা পেটা করা হোক। 
Religious Hate	হিন্দু শোয়ামিজি খুব সুন্দর উত্তর দিয়েছে
Religious Hate	আল্লাহ আমায় তৌফিক দিলে আমি সারা বাংলা ঘুরে এই সমস্ত বজ্জাত জাহেল আলেম নামের শয়তান গুলারে পিটাইয়া স্টেজ থেকে নামাইতাম। 
Religious Hate	জাকির নায়েক ধর্ম ব্যবসা বন্ধ করে দেওয়াতে এদের ঘুম হারাম হয়ে গেছে। 
Religious Hate	এগুলো কাট মোললা বলা হয় এরা কি নিজেকে মুসলিম মনে করে জাকির নাকেয় য়ের জুতা টানার মতো জগোতা হয় নাই 
Religious Hate	আল্লাহ এই হুজুরকে হেদায়েত দেন ছাগল হুজুর । 
Religious Hate	এই শালা কে কি কুত্তা পয়দা করছিল নাকি শয়তান পয়দা করছিল সালায় কয় কি
Religious Hate	ওর টুপির নিচে শয়তান আছে মনে হয়
Religious Hate	কাটমোল্লাদের তাদের ধর্ম ব্যবসায় বন্ধ হয়ে গেছে,তাই তার উপর খুব রাগ, আরে ভাই সত্য চিরন্তর, মিথ্যা সাময়িক, 
Religious Hate	কাঠমোল্লা জাকের নাইকের জুতার সমান মুল্য তোর নাই। 
Religious Hate	জদ্দা খোর সাইফল্লাহ কিসের আলেম। 
Religious Hate	এইসব কাটমোললারে জুতা মারলেও লজ্জা হবেনা।
Religious Hate	হিন্দু ধর্মই একমাত্র চোদাচুদির ধর্ম 
Religious Hate	আমার ধনেরা সার্বজনীন চোদাও,
Religious Hate	সময় টিভির মালিক যে হিন্দুদের বংশধর এটা সবাই জানে
Religious Hate	মুসলিম নামের নাস্তিকরা এখন দেখিস না তোর হিন্দু বাপেরা মুসলিমদের প্রকাশ্যে ধর্ষন করলো
Religious Hate	পাকিস্তানদের মতো আমাদের দেশ থাকত তাইলে হিন্দুদের সাথে ধরষন করতাম 
